{
  "$schema": "https://json-schema.org/draft/2020-12/schema",
  "title": "ContentImplementationPlan",
  "type": "object",
  "required": ["schema_version", "design_spec_id", "tasks", "handoff_criteria"],
  "properties": {
    "schema_version": {"const": 1},
    "design_spec_id": {"type": "string", "minLength": 1},
    "tasks": {"type": "array", "minItems": 1},
    "handoff_criteria": {
      "type": "array",
      "minItems": 1,
      "items": {"type": "string", "minLength": 1}
    }
  }
}
